commit	avg_net_yield	time_in_range	status	description
190	0.016278	0.9997	discard	Looking at the experiment history, I've been plateauing around 0.018437-0.018562 for over 150 iterat
191	0.018449	1.0000	discard	Looking at the experiment history, I notice we've been plateaued at 0.018437-0.018562 for over 150 i
192	0.003293	0.9789	discard	Looking at the experiment history, I notice we've been plateaued around 0.018437-0.018562 for over 1
193	-0.005898	0.9254	discard	Looking at the experiment history, I notice we've been plateaued at 0.018437-0.018562 for over 150 i
